Sheet: Кругозор
A1: Категория | B1: Февраль | C1: Март | D1: Апрель | E1: Итого
A2: Детская | B2: 12 | C2: 23 | D2: 8 | E2: of:=SUM([.B2:.D2]) -> 43
A3: Техническая | B3: 51 | C3: 15 | D3: 10 | E3: of:=SUM([.B3:.D3]) -> 76
A4: Художественная | B4: 28 | C4: 19 | D4: 37 | E4: of:=SUM([.B4:.D4]) -> 84
A5: Юридическая | B5: 15 | C5: 23 | D5: 6 | E5: of:=SUM([.B5:.D5]) -> 44
A6: Экономическая | B6: 52 | C6: 10 | D6: 8 | E6: of:=SUM([.B6:.D6]) -> 70
A7: Итого | B7: of:=SUM([.B2:.B6]) -> 158 | C7: of:=SUM([.C2:.C6]) -> 90 | D7: of:=SUM([.D2:.D6]) -> 69 | E7: of:=SUM([.B7:.D7]) -> 317

Sheet: Горизонт
A1: Категория | B1: Январь | C1: Март | D1: Апрель | E1: Итого
A2: Информац. технологии | B2: 24 | C2: 12 | D2: 9 | E2: of:=SUM([.B2:.D2]) -> 45
A3: Техническая | B3: 23 | C3: 64 | D3: 5 | E3: of:=SUM([.B3:.D3]) -> 92
A4: Художественная | B4: 20 | C4: 54 | D4: 23 | E4: of:=SUM([.B4:.D4]) -> 97
A5: Юридическая | B5: 55 | C5: 14 | D5: 63 | E5: of:=SUM([.B5:.D5]) -> 132
A6: Экономическая | B6: 5 | C6: 45 | D6: 6 | E6: of:=SUM([.B6:.D6]) -> 56
A7: Учебная | B7: 45 | C7: 39 | D7: 62 | E7: of:=SUM([.B7:.D7]) -> 146
A8: Итого | B8: of:=SUM([.B2:.B7]) -> 172 | C8: of:=SUM([.C2:.C7]) -> 228 | D8: of:=SUM([.D2:.D7]) -> 168 | E8: of:=SUM([.B8:.D8]) -> 568

Sheet: Мир книг
A1: Категория | B1: Январь | C1: Февраль | D1: Март | E1: Апрель | F1: Итого
A2: Информац. технологии | B2: 47 | C2: 35 | D2: 21 | E2: 45 | F2: of:=SUM([.B2:.E2]) -> 148
A3: Детская | B3: 22 | C3: 53 | D3: 14 | E3: 19 | F3: of:=SUM([.B3:.E3]) -> 108
A4: Техническая | B4: 17 | C4: 9 | D4: 44 | E4: 19 | F4: of:=SUM([.B4:.E4]) -> 89
A5: Художественная | B5: 29 | C5: 33 | D5: 20 | E5: 28 | F5: of:=SUM([.B5:.E5]) -> 110
A6: Юридическая | B6: 51 | C6: 51 | D6: 5 | E6: 9 | F6: of:=SUM([.B6:.E6]) -> 116
A7: Экономическая | B7: 10 | C7: 17 | D7: 24 | E7: 22 | F7: of:=SUM([.B7:.E7]) -> 73
A8: Учебная | B8: 52 | C8: 55 | D8: 34 | E8: 59 | F8: of:=SUM([.B8:.E8]) -> 200
A9: Итого | B9: of:=SUM([.B2:.B8]) -> 228 | C9: of:=SUM([.C2:.C8]) -> 253 | D9: of:=SUM([.D2:.D8]) -> 162 | E9: of:=SUM([.E2:.E8]) -> 201 | F9: of:=SUM([.B9:.E9]) -> 844

Sheet: Итог
A1: Категория | B1: Февраль | C1: Март | D1: Апрель | E1: Итого | F1: Январь
A2: Детская / Кругозор | B2: of:=[$Кругозор.$B$2] -> 12 | C2: of:=[$Кругозор.$C$2] -> 23 | D2: of:=[$Кругозор.$D$2] -> 8 | E2: of:=[$Кругозор.$E$2] -> 43
A3: Детская / Мир книг | B3: of:=[$'Мир книг'.$C$3] -> 53 | C3: of:=[$'Мир книг'.$D$3] -> 14 | D3: of:=[$'Мир книг'.$E$3] -> 19 | E3: of:=[$'Мир книг'.$F$3] -> 108 | F3: of:=[$'Мир книг'.$B$3] -> 22
A4: Детская | B4: of:=SUM([.B2:.B3]) -> 65 | C4: of:=SUM([.C2:.C3]) -> 37 | D4: of:=SUM([.D2:.D3]) -> 27 | E4: of:=SUM([.E2:.E3]) -> 151 | F4: of:=SUM([.F2:.F3]) -> 22
A5: Техническая / Кругозор | B5: of:=[$Кругозор.$B$3] -> 51 | C5: of:=[$Кругозор.$C$3] -> 15 | D5: of:=[$Кругозор.$D$3] -> 10 | E5: of:=[$Кругозор.$E$3] -> 76
A6: Техническая / Горизонт | C6: of:=[$Горизонт.$C$3] -> 64 | D6: of:=[$Горизонт.$D$3] -> 5 | E6: of:=[$Горизонт.$E$3] -> 92 | F6: of:=[$Горизонт.$B$3] -> 23
A7: Техническая / Мир книг | B7: of:=[$'Мир книг'.$C$4] -> 9 | C7: of:=[$'Мир книг'.$D$4] -> 44 | D7: of:=[$'Мир книг'.$E$4] -> 19 | E7: of:=[$'Мир книг'.$F$4] -> 89 | F7: of:=[$'Мир книг'.$B$4] -> 17
A8: Техническая | B8: of:=SUM([.B5:.B7]) -> 60 | C8: of:=SUM([.C5:.C7]) -> 123 | D8: of:=SUM([.D5:.D7]) -> 34 | E8: of:=SUM([.E5:.E7]) -> 257 | F8: of:=SUM([.F5:.F7]) -> 40
A9: Художественная / Кругозор | B9: of:=[$Кругозор.$B$4] -> 28 | C9: of:=[$Кругозор.$C$4] -> 19 | D9: of:=[$Кругозор.$D$4] -> 37 | E9: of:=[$Кругозор.$E$4] -> 84
A10: Художественная / Горизонт | C10: of:=[$Горизонт.$C$4] -> 54 | D10: of:=[$Горизонт.$D$4] -> 23 | E10: of:=[$Горизонт.$E$4] -> 97 | F10: of:=[$Горизонт.$B$4] -> 20
A11: Художественная / Мир книг | B11: of:=[$'Мир книг'.$C$5] -> 33 | C11: of:=[$'Мир книг'.$D$5] -> 20 | D11: of:=[$'Мир книг'.$E$5] -> 28 | E11: of:=[$'Мир книг'.$F$5] -> 110 | F11: of:=[$'Мир книг'.$B$5] -> 29
A12: Художественная | B12: of:=SUM([.B9:.B11]) -> 61 | C12: of:=SUM([.C9:.C11]) -> 93 | D12: of:=SUM([.D9:.D11]) -> 88 | E12: of:=SUM([.E9:.E11]) -> 291 | F12: of:=SUM([.F9:.F11]) -> 49
A13: Юридическая / Кругозор | B13: of:=[$Кругозор.$B$5] -> 15 | C13: of:=[$Кругозор.$C$5] -> 23 | D13: of:=[$Кругозор.$D$5] -> 6 | E13: of:=[$Кругозор.$E$5] -> 44
A14: Юридическая / Горизонт | C14: of:=[$Горизонт.$C$5] -> 14 | D14: of:=[$Горизонт.$D$5] -> 63 | E14: of:=[$Горизонт.$E$5] -> 132 | F14: of:=[$Горизонт.$B$5] -> 55
A15: Юридическая / Мир книг | B15: of:=[$'Мир книг'.$C$6] -> 51 | C15: of:=[$'Мир книг'.$D$6] -> 5 | D15: of:=[$'Мир книг'.$E$6] -> 9 | E15: of:=[$'Мир книг'.$F$6] -> 116 | F15: of:=[$'Мир книг'.$B$6] -> 51
A16: Юридическая | B16: of:=SUM([.B13:.B15]) -> 66 | C16: of:=SUM([.C13:.C15]) -> 42 | D16: of:=SUM([.D13:.D15]) -> 78 | E16: of:=SUM([.E13:.E15]) -> 292 | F16: of:=SUM([.F13:.F15]) -> 106
A17: Экономическая / Кругозор | B17: of:=[$Кругозор.$B$6] -> 52 | C17: of:=[$Кругозор.$C$6] -> 10 | D17: of:=[$Кругозор.$D$6] -> 8 | E17: of:=[$Кругозор.$E$6] -> 70
A18: Экономическая / Горизонт | C18: of:=[$Горизонт.$C$6] -> 45 | D18: of:=[$Горизонт.$D$6] -> 6 | E18: of:=[$Горизонт.$E$6] -> 56 | F18: of:=[$Горизонт.$B$6] -> 5
A19: Экономическая / Мир книг | B19: of:=[$'Мир книг'.$C$7] -> 17 | C19: of:=[$'Мир книг'.$D$7] -> 24 | D19: of:=[$'Мир книг'.$E$7] -> 22 | E19: of:=[$'Мир книг'.$F$7] -> 73 | F19: of:=[$'Мир книг'.$B$7] -> 10
A20: Экономическая | B20: of:=SUM([.B17:.B19]) -> 69 | C20: of:=SUM([.C17:.C19]) -> 79 | D20: of:=SUM([.D17:.D19]) -> 36 | E20: of:=SUM([.E17:.E19]) -> 199 | F20: of:=SUM([.F17:.F19]) -> 15
A21: Итого / Кругозор | B21: of:=[$Кругозор.$B$7] -> 158 | C21: of:=[$Кругозор.$C$7] -> 90 | D21: of:=[$Кругозор.$D$7] -> 69 | E21: of:=[$Кругозор.$E$7] -> 317
A22: Итого / Горизонт | C22: of:=[$Горизонт.$C$8] -> 228 | D22: of:=[$Горизонт.$D$8] -> 168 | E22: of:=[$Горизонт.$E$8] -> 568 | F22: of:=[$Горизонт.$B$8] -> 172
A23: Итого / Мир книг | B23: of:=[$'Мир книг'.$C$9] -> 253 | C23: of:=[$'Мир книг'.$D$9] -> 162 | D23: of:=[$'Мир книг'.$E$9] -> 201 | E23: of:=[$'Мир книг'.$F$9] -> 844 | F23: of:=[$'Мир книг'.$B$9] -> 228
A24: Итого | B24: of:=SUM([.B21:.B23]) -> 411 | C24: of:=SUM([.C21:.C23]) -> 480 | D24: of:=SUM([.D21:.D23]) -> 438 | E24: of:=SUM([.E21:.E23]) -> 1729 | F24: of:=SUM([.F21:.F23]) -> 400
A25: Информац. технологии / Горизонт | C25: of:=[$Горизонт.$C$2] -> 12 | D25: of:=[$Горизонт.$D$2] -> 9 | E25: of:=[$Горизонт.$E$2] -> 45 | F25: of:=[$Горизонт.$B$2] -> 24
A26: Информац. технологии / Мир книг | B26: of:=[$'Мир книг'.$C$2] -> 35 | C26: of:=[$'Мир книг'.$D$2] -> 21 | D26: of:=[$'Мир книг'.$E$2] -> 45 | E26: of:=[$'Мир книг'.$F$2] -> 148 | F26: of:=[$'Мир книг'.$B$2] -> 47
A27: Информац. технологии | B27: of:=SUM([.B25:.B26]) -> 35 | C27: of:=SUM([.C25:.C26]) -> 33 | D27: of:=SUM([.D25:.D26]) -> 54 | E27: of:=SUM([.E25:.E26]) -> 193 | F27: of:=SUM([.F25:.F26]) -> 71
A28: Учебная / Горизонт | C28: of:=[$Горизонт.$C$7] -> 39 | D28: of:=[$Горизонт.$D$7] -> 62 | E28: of:=[$Горизонт.$E$7] -> 146 | F28: of:=[$Горизонт.$B$7] -> 45
A29: Учебная / Мир книг | B29: of:=[$'Мир книг'.$C$8] -> 55 | C29: of:=[$'Мир книг'.$D$8] -> 34 | D29: of:=[$'Мир книг'.$E$8] -> 59 | E29: of:=[$'Мир книг'.$F$8] -> 200 | F29: of:=[$'Мир книг'.$B$8] -> 52
A30: Учебная | B30: of:=SUM([.B28:.B29]) -> 55 | C30: of:=SUM([.C28:.C29]) -> 73 | D30: of:=SUM([.D28:.D29]) -> 121 | E30: of:=SUM([.E28:.E29]) -> 346 | F30: of:=SUM([.F28:.F29]) -> 97

Sheet: Октябрь
A1: Ведомость за октябрь
A2: Начисление | F2: Удержание
A3: ФИО | B3: Оклад | C3: Надбавка | D3: Премия | E3: Начислено | F3: Подоход. налог | G3: ФСЗН | H3: Удержано | I3: К выдаче
A4: Александров | B4: 250000 | C4: 60000 | D4: 50000 | E4: 360000 | F4: 43200 | G4: 28800 | H4: 72000 | I4: 288000
A5: Иванов | B5: 300000 | C5: 100000 | D5: 60000 | E5: 460000 | F5: 55200 | G5: 36800 | H5: 92000 | I5: 368000
A6: Петров | B6: 300000 | C6: 50000 | D6: 60000 | E6: 410000 | F6: 49200 | G6: 32800 | H6: 82000 | I6: 328000
A7: Семенов | B7: 150000 | C7: 40000 | D7: 40000 | E7: 240000 | F7: 26400 | G7: 17600 | H7: 44000 | I7: 176000

Sheet: Ноябрь
A1: Ведомость за ноябрь
A2: Начисление | F2: Удержание
A3: ФИО | B3: Оклад | C3: Надбавка | D3: Премия | E3: Начислено | F3: Подоход. налог | G3: ФСЗН | H3: Удержано | I3: К выдаче
A4: Александров | B4: 250000 | C4: 60000 | D4: 50000 | E4: 360000 | F4: 43200 | G4: 28800 | H4: 72000 | I4: 288000
A5: Иванов | B5: 180000 | C5: 100000 | D5: 36000 | E5: 316000 | F5: 37920 | G5: 25280 | H5: 63200 | I5: 252800
A6: Семенов | B6: 250000 | C6: 40000 | D6: 50000 | E6: 340000 | F6: 40800 | G6: 27200 | H6: 68000 | I6: 272000
A7: Петров | B7: 180000 | C7: 100000 | D7: 36000 | E7: 316000 | F7: 37920 | G7: 25280 | H7: 63200 | I7: 252800

Sheet: Консолидация
A1: ФИО | B1: Оклад | C1: Надбавка | D1: Премия | E1: Начислено | F1: Подоход. налог | G1: ФСЗН | H1: Удержано | I1: К выдаче
A2: Александров | B2: 500000 | C2: 120000 | D2: 100000 | E2: 720000 | F2: 86400 | G2: 57600 | H2: 144000 | I2: 576000
A3: Иванов | B3: 480000 | C3: 200000 | D3: 96000 | E3: 776000 | F3: 93120 | G3: 62080 | H3: 155200 | I3: 620800
A4: Петров | B4: 480000 | C4: 150000 | D4: 96000 | E4: 726000 | F4: 87120 | G4: 58080 | H4: 145200 | I4: 580800
A5: Семенов | B5: 400000 | C5: 80000 | D5: 90000 | E5: 580000 | F5: 67200 | G5: 44800 | H5: 112000 | I5: 448000

Sheet: Сентябрь
A1: Ведомость за сентябрь
A2: Начисление | F2: Удержание
A3: ФИО | B3: Оклад | C3: Надбавка | D3: Премия | E3: Начислено | F3: Подоход. налог | G3: ФСЗН | H3: Удержано | I3: К выдаче
A4: Александров | B4: 250000 | C4: 60000 | D4: 50000 | E4: 360000 | F4: 43200 | G4: 28800 | H4: 72000 | I4: 288000
A5: Иванов | B5: 150000 | C5: 40000 | D5: 40000 | E5: 240000 | F5: 26400 | G5: 17600 | H5: 44000 | I5: 176000
A6: Семенов | B6: 300000 | C6: 100000 | D6: 60000 | E6: 460000 | F6: 55200 | G6: 36800 | H6: 92000 | I6: 368000
A7: Петров | B7: 180000 | C7: 100000 | D7: 36000 | E7: 316000 | F7: 37920 | G7: 25280 | H7: 63200 | I7: 252800

Sheet: Таблицы
A1: ФИО | B1: Оклад | C1: Надбавка | D1: Премия | E1: Начислено | F1: Подоход. налог | G1: ФСЗН | H1: Удержано | I1: К выдаче
A2: Александров | B2: 750000 | C2: 180000 | D2: 150000 | E2: 1080000 | F2: 129600 | G2: 86400 | H2: 216000 | I2: 864000
A3: Иванов | B3: 630000 | C3: 240000 | D3: 136000 | E3: 1016000 | F3: 119520 | G3: 79680 | H3: 199200 | I3: 796800
A4: Петров | B4: 660000 | C4: 250000 | D4: 132000 | E4: 1042000 | F4: 125040 | G4: 83360 | H4: 208400 | I4: 833600
A5: Семенов | B5: 700000 | C5: 180000 | D5: 150000 | E5: 1040000 | F5: 122400 | G5: 81600 | H5: 204000 | I5: 816000
A8: Ведомость за сентябрь
A9: Начисление
A10: ФИО | B10: Оклад | C10: Надбавка | D10: Премия | E10: Начислено
A11: Иванов И.И. | B11: 250000 | C11: 100000 | D11: 50000 | E11: 400000
A14: Ведомость за октябрь
A15: Начисление | B15: Удержание
A16: ФИО | B16: Подоход. налог | C16: ФСЗН | D16: Удержано | E16: К выдаче
A17: Александров | B17: 43200 | C17: 28800 | D17: 72000 | E17: 288000
A18: Иванов | B18: 55200 | C18: 36800 | D18: 92000 | E18: 368000
A19: Петров | B19: 49200 | C19: 32800 | D19: 82000 | E19: 328000
A20: Семенов | B20: 26400 | C20: 17600 | D20: 44000 | E20: 176000
A23: Ведомость за ноябрь
A24: Начисление | B24: Удержание
A25: ФИО | B25: Подоход. налог | C25: ФСЗН | D25: Удержано | E25: К выдаче
A26: Александров | B26: 43200 | C26: 28800 | D26: 72000 | E26: 288000
A27: Иванов | B27: 37920 | C27: 25280 | D27: 63200 | E27: 252800
A28: Семенов | B28: 40800 | C28: 27200 | D28: 68000 | E28: 272000

Sheet: Консолидация2
A1: ФИО | B1: Оклад | C1: Надбавка | D1: Премия | E1: Начислено | F1: Подоход. налог | G1: ФСЗН | H1: Удержано | I1: К выдаче
A2: Иванов И.И. / Таблицы | B2: of:=[$Таблицы.$B$11] -> 250000 | C2: of:=[$Таблицы.$C$11] -> 100000 | D2: of:=[$Таблицы.$D$11] -> 50000 | E2: of:=[$Таблицы.$E$11] -> 400000
A3: Иванов И.И. | B3: of:=SUM([.B2:.B2]) -> 250000 | C3: of:=SUM([.C2:.C2]) -> 100000 | D3: of:=SUM([.D2:.D2]) -> 50000 | E3: of:=SUM([.E2:.E2]) -> 400000 | F3: of:=SUM([.F2:.F2]) -> 0 | G3: of:=SUM([.G2:.G2]) -> 0 | H3: of:=SUM([.H2:.H2]) -> 0 | I3: of:=SUM([.I2:.I2]) -> 0
A4: Александров / Таблицы | F4: of:=[$Таблицы.$B$17] -> 43200 | G4: of:=[$Таблицы.$C$17] -> 28800 | H4: of:=[$Таблицы.$D$17] -> 72000 | I4: of:=[$Таблицы.$E$17] -> 288000
A5: Александров / Таблицы | F5: of:=[$Таблицы.$B$26] -> 43200 | G5: of:=[$Таблицы.$C$26] -> 28800 | H5: of:=[$Таблицы.$D$26] -> 72000 | I5: of:=[$Таблицы.$E$26] -> 288000
A6: Александров | B6: of:=SUM([.B4:.B5]) -> 0 | C6: of:=SUM([.C4:.C5]) -> 0 | D6: of:=SUM([.D4:.D5]) -> 0 | E6: of:=SUM([.E4:.E5]) -> 0 | F6: of:=SUM([.F4:.F5]) -> 86400 | G6: of:=SUM([.G4:.G5]) -> 57600 | H6: of:=SUM([.H4:.H5]) -> 144000 | I6: of:=SUM([.I4:.I5]) -> 576000
A7: Иванов / Таблицы | F7: of:=[$Таблицы.$B$18] -> 55200 | G7: of:=[$Таблицы.$C$18] -> 36800 | H7: of:=[$Таблицы.$D$18] -> 92000 | I7: of:=[$Таблицы.$E$18] -> 368000
A8: Иванов / Таблицы | F8: of:=[$Таблицы.$B$27] -> 37920 | G8: of:=[$Таблицы.$C$27] -> 25280 | H8: of:=[$Таблицы.$D$27] -> 63200 | I8: of:=[$Таблицы.$E$27] -> 252800
A9: Иванов | B9: of:=SUM([.B7:.B8]) -> 0 | C9: of:=SUM([.C7:.C8]) -> 0 | D9: of:=SUM([.D7:.D8]) -> 0 | E9: of:=SUM([.E7:.E8]) -> 0 | F9: of:=SUM([.F7:.F8]) -> 93120 | G9: of:=SUM([.G7:.G8]) -> 62080 | H9: of:=SUM([.H7:.H8]) -> 155200 | I9: of:=SUM([.I7:.I8]) -> 620800
A10: Петров / Таблицы | F10: of:=[$Таблицы.$B$19] -> 49200 | G10: of:=[$Таблицы.$C$19] -> 32800 | H10: of:=[$Таблицы.$D$19] -> 82000 | I10: of:=[$Таблицы.$E$19] -> 328000
A11: Петров | B11: of:=SUM([.B10:.B10]) -> 0 | C11: of:=SUM([.C10:.C10]) -> 0 | D11: of:=SUM([.D10:.D10]) -> 0 | E11: of:=SUM([.E10:.E10]) -> 0 | F11: of:=SUM([.F10:.F10]) -> 49200 | G11: of:=SUM([.G10:.G10]) -> 32800 | H11: of:=SUM([.H10:.H10]) -> 82000 | I11: of:=SUM([.I10:.I10]) -> 328000
A12: Семенов / Таблицы | F12: of:=[$Таблицы.$B$20] -> 26400 | G12: of:=[$Таблицы.$C$20] -> 17600 | H12: of:=[$Таблицы.$D$20] -> 44000 | I12: of:=[$Таблицы.$E$20] -> 176000
A13: Семенов / Таблицы | F13: of:=[$Таблицы.$B$28] -> 40800 | G13: of:=[$Таблицы.$C$28] -> 27200 | H13: of:=[$Таблицы.$D$28] -> 68000 | I13: of:=[$Таблицы.$E$28] -> 272000
A14: Семенов | B14: of:=SUM([.B12:.B13]) -> 0 | C14: of:=SUM([.C12:.C13]) -> 0 | D14: of:=SUM([.D12:.D13]) -> 0 | E14: of:=SUM([.E12:.E13]) -> 0 | F14: of:=SUM([.F12:.F13]) -> 67200 | G14: of:=SUM([.G12:.G13]) -> 44800 | H14: of:=SUM([.H12:.H13]) -> 112000 | I14: of:=SUM([.I12:.I13]) -> 448000

Sheet: Январь
A1: Районы | B1: Норма потребления | C1: Перерасход | D1: Общее потребление
A2: Увельский | B2: 245 | C2: 21 | D2: of:=[.B2]+[.C2] -> 266 | F2: на оценку «отлично»
A3: Каслинский | B3: 621 | C3: 54 | D3: of:=[.B3]+[.C3] -> 675 | F3: вариант 5
A4: Сосновский | B4: 754 | C4: 43 | D4: of:=[.B4]+[.C4] -> 797
A5: Красноармейский | B5: 123 | C5: 23 | D5: of:=[.B5]+[.C5] -> 146

Sheet: Февраль
A1: Районы | B1: Норма потребления | C1: Перерасход | D1: Общее потребление
A2: Увельский | B2: 235 | C2: 23 | D2: of:=[.B2]+[.C2] -> 258
A3: Каслинский | B3: 126 | C3: 11 | D3: of:=[.B3]+[.C3] -> 137
A4: Сосновский | B4: 625 | C4: 61 | D4: of:=[.B4]+[.C4] -> 686
A5: Красноармейский | B5: 166 | C5: 11 | D5: of:=[.B5]+[.C5] -> 177

Sheet: Март
A1: Районы | B1: Норма потребления | C1: Перерасход | D1: Общее потребление
A2: Увельский | B2: 553 | C2: 16 | D2: of:=[.B2]+[.C2] -> 569
A3: Каслинский | B3: 611 | C3: 5 | D3: of:=[.B3]+[.C3] -> 616
A4: Сосновский | B4: 341 | C4: 11 | D4: of:=[.B4]+[.C4] -> 352
A5: Красноармейский | B5: 563 | C5: 63 | D5: of:=[.B5]+[.C5] -> 626

Sheet: Консолидация3
A1: Районы | B1: Норма потребления | C1: Перерасход | D1: Общее потребление
A2: Увельский / Январь | B2: of:=[$Январь.$B$2] -> 245 | C2: of:=[$Январь.$C$2] -> 21 | D2: of:=[$Январь.$D$2] -> 266
A3: Увельский / Февраль | B3: of:=[$Февраль.$B$2] -> 235 | C3: of:=[$Февраль.$C$2] -> 23 | D3: of:=[$Февраль.$D$2] -> 258
A4: Увельский / Март | B4: of:=[$Март.$B$2] -> 553 | C4: of:=[$Март.$C$2] -> 16 | D4: of:=[$Март.$D$2] -> 569
A5: Увельский | B5: of:=SUM([.B2:.B4]) -> 1033 | C5: of:=SUM([.C2:.C4]) -> 60 | D5: of:=SUM([.D2:.D4]) -> 1093
A6: Каслинский / Январь | B6: of:=[$Январь.$B$3] -> 621 | C6: of:=[$Январь.$C$3] -> 54 | D6: of:=[$Январь.$D$3] -> 675
A7: Каслинский / Февраль | B7: of:=[$Февраль.$B$3] -> 126 | C7: of:=[$Февраль.$C$3] -> 11 | D7: of:=[$Февраль.$D$3] -> 137
A8: Каслинский / Март | B8: of:=[$Март.$B$3] -> 611 | C8: of:=[$Март.$C$3] -> 5 | D8: of:=[$Март.$D$3] -> 616
A9: Каслинский | B9: of:=SUM([.B6:.B8]) -> 1358 | C9: of:=SUM([.C6:.C8]) -> 70 | D9: of:=SUM([.D6:.D8]) -> 1428
A10: Сосновский / Январь | B10: of:=[$Январь.$B$4] -> 754 | C10: of:=[$Январь.$C$4] -> 43 | D10: of:=[$Январь.$D$4] -> 797
A11: Сосновский / Февраль | B11: of:=[$Февраль.$B$4] -> 625 | C11: of:=[$Февраль.$C$4] -> 61 | D11: of:=[$Февраль.$D$4] -> 686
A12: Сосновский / Март | B12: of:=[$Март.$B$4] -> 341 | C12: of:=[$Март.$C$4] -> 11 | D12: of:=[$Март.$D$4] -> 352
A13: Сосновский | B13: of:=SUM([.B10:.B12]) -> 1720 | C13: of:=SUM([.C10:.C12]) -> 115 | D13: of:=SUM([.D10:.D12]) -> 1835
A14: Красноармейский / Январь | B14: of:=[$Январь.$B$5] -> 123 | C14: of:=[$Январь.$C$5] -> 23 | D14: of:=[$Январь.$D$5] -> 146
A15: Красноармейский / Февраль | B15: of:=[$Февраль.$B$5] -> 166 | C15: of:=[$Февраль.$C$5] -> 11 | D15: of:=[$Февраль.$D$5] -> 177
A16: Красноармейский / Март | B16: of:=[$Март.$B$5] -> 563 | C16: of:=[$Март.$C$5] -> 63 | D16: of:=[$Март.$D$5] -> 626
A17: Красноармейский | B17: of:=SUM([.B14:.B16]) -> 852 | C17: of:=SUM([.C14:.C16]) -> 97 | D17: of:=SUM([.D14:.D16]) -> 949