Sheet: Sheet1
A1: № | B1: x | C1: A | D1: B | E1: C | F1: D | G1: E
A2: 1 | B2: 14.7 | C2: of:=ROUND([.B2]*[.B2]-3*[.B2]+1;1) -> 173 | D2: of:=ROUND(3*[.B2]*SQRT(SIN(3*[.B2])+7);1) -> 117.7 | E2: of:=ROUND(3*[.C2]-[.D2];1) -> 401.3 | F2: of:=ROUND(HARMEAN([.$B$2:.B2]);1) -> 14.7 | G2: of:=ROUND(IF([.B2]>0;LN([.B2]);SQRT(-1*[.B2]+2));1) -> 2.7
A3: 2 | B3: of:=[.B2]+1.1 -> 15.8 | C3: of:=ROUND([.B3]*[.B3]-3*[.B3]+1;1) -> 203.2 | D3: of:=ROUND(3*[.B3]*SQRT(SIN(3*[.B3])+7);1) -> 122.9 | E3: of:=ROUND(3*[.C3]-[.D3];1) -> 486.7 | F3: of:=ROUND(HARMEAN([.$B$2:.B3]);1) -> 15.2 | G3: of:=ROUND(IF([.B3]>0;LN([.B3]);SQRT(-1*[.B3]+2));1) -> 2.8
A4: 3 | B4: of:=[.B3]+1.1 -> 16.9 | C4: of:=ROUND([.B4]*[.B4]-3*[.B4]+1;1) -> 235.9 | D4: of:=ROUND(3*[.B4]*SQRT(SIN(3*[.B4])+7);1) -> 138.1 | E4: of:=ROUND(3*[.C4]-[.D4];1) -> 569.6 | F4: of:=ROUND(HARMEAN([.$B$2:.B4]);1) -> 15.7 | G4: of:=ROUND(IF([.B4]>0;LN([.B4]);SQRT(-1*[.B4]+2));1) -> 2.8
A5: 4 | B5: of:=[.B4]+1.1 -> 18 | C5: of:=ROUND([.B5]*[.B5]-3*[.B5]+1;1) -> 271 | D5: of:=ROUND(3*[.B5]*SQRT(SIN(3*[.B5])+7);1) -> 137 | E5: of:=ROUND(3*[.C5]-[.D5];1) -> 676 | F5: of:=ROUND(HARMEAN([.$B$2:.B5]);1) -> 16.3 | G5: of:=ROUND(IF([.B5]>0;LN([.B5]);SQRT(-1*[.B5]+2));1) -> 2.9
A6: 5 | B6: of:=[.B5]+1.1 -> 19.1 | C6: of:=ROUND([.B6]*[.B6]-3*[.B6]+1;1) -> 308.5 | D6: of:=ROUND(3*[.B6]*SQRT(SIN(3*[.B6])+7);1) -> 158.8 | E6: of:=ROUND(3*[.C6]-[.D6];1) -> 766.7 | F6: of:=ROUND(HARMEAN([.$B$2:.B6]);1) -> 16.8 | G6: of:=ROUND(IF([.B6]>0;LN([.B6]);SQRT(-1*[.B6]+2));1) -> 2.9
A7: 6 | B7: of:=[.B6]+1.1 -> 20.2 | C7: of:=ROUND([.B7]*[.B7]-3*[.B7]+1;1) -> 348.4 | D7: of:=ROUND(3*[.B7]*SQRT(SIN(3*[.B7])+7);1) -> 151 | E7: of:=ROUND(3*[.C7]-[.D7];1) -> 894.2 | F7: of:=ROUND(HARMEAN([.$B$2:.B7]);1) -> 17.2 | G7: of:=ROUND(IF([.B7]>0;LN([.B7]);SQRT(-1*[.B7]+2));1) -> 3
A8: 7 | B8: of:=[.B7]+1.1 -> 21.3 | C8: of:=ROUND([.B8]*[.B8]-3*[.B8]+1;1) -> 390.8 | D8: of:=ROUND(3*[.B8]*SQRT(SIN(3*[.B8])+7);1) -> 179.3 | E8: of:=ROUND(3*[.C8]-[.D8];1) -> 993.1 | F8: of:=ROUND(HARMEAN([.$B$2:.B8]);1) -> 17.7 | G8: of:=ROUND(IF([.B8]>0;LN([.B8]);SQRT(-1*[.B8]+2));1) -> 3.1
A9: 8 | B9: of:=[.B8]+1.1 -> 22.4 | C9: of:=ROUND([.B9]*[.B9]-3*[.B9]+1;1) -> 435.6 | D9: of:=ROUND(3*[.B9]*SQRT(SIN(3*[.B9])+7);1) -> 165.4 | E9: of:=ROUND(3*[.C9]-[.D9];1) -> 1141.4 | F9: of:=ROUND(HARMEAN([.$B$2:.B9]);1) -> 18.2 | G9: of:=ROUND(IF([.B9]>0;LN([.B9]);SQRT(-1*[.B9]+2));1) -> 3.1
A10: 9 | B10: of:=[.B9]+1.1 -> 23.5 | C10: of:=ROUND([.B10]*[.B10]-3*[.B10]+1;1) -> 482.8 | D10: of:=ROUND(3*[.B10]*SQRT(SIN(3*[.B10])+7);1) -> 199.2 | E10: of:=ROUND(3*[.C10]-[.D10];1) -> 1249.2 | F10: of:=ROUND(HARMEAN([.$B$2:.B10]);1) -> 18.7 | G10: of:=ROUND(IF([.B10]>0;LN([.B10]);SQRT(-1*[.B10]+2));1) -> 3.2
A11: 10 | B11: of:=[.B10]+1.1 -> 24.6 | C11: of:=ROUND([.B11]*[.B11]-3*[.B11]+1;1) -> 532.4 | D11: of:=ROUND(3*[.B11]*SQRT(SIN(3*[.B11])+7);1) -> 180.8 | E11: of:=ROUND(3*[.C11]-[.D11];1) -> 1416.4 | F11: of:=ROUND(HARMEAN([.$B$2:.B11]);1) -> 19.1 | G11: of:=ROUND(IF([.B11]>0;LN([.B11]);SQRT(-1*[.B11]+2));1) -> 3.2
A12: 11 | B12: of:=[.B11]+1.1 -> 25.7 | C12: of:=ROUND([.B12]*[.B12]-3*[.B12]+1;1) -> 584.4 | D12: of:=ROUND(3*[.B12]*SQRT(SIN(3*[.B12])+7);1) -> 218 | E12: of:=ROUND(3*[.C12]-[.D12];1) -> 1535.2 | F12: of:=ROUND(HARMEAN([.$B$2:.B12]);1) -> 19.6 | G12: of:=ROUND(IF([.B12]>0;LN([.B12]);SQRT(-1*[.B12]+2));1) -> 3.2
A13: 12 | B13: of:=[.B12]+1.1 -> 26.8 | C13: of:=ROUND([.B13]*[.B13]-3*[.B13]+1;1) -> 638.8 | D13: of:=ROUND(3*[.B13]*SQRT(SIN(3*[.B13])+7);1) -> 197.6 | E13: of:=ROUND(3*[.C13]-[.D13];1) -> 1718.8 | F13: of:=ROUND(HARMEAN([.$B$2:.B13]);1) -> 20 | G13: of:=ROUND(IF([.B13]>0;LN([.B13]);SQRT(-1*[.B13]+2));1) -> 3.3
A14: 13 | B14: of:=[.B13]+1.1 -> 27.9 | C14: of:=ROUND([.B14]*[.B14]-3*[.B14]+1;1) -> 695.7 | D14: of:=ROUND(3*[.B14]*SQRT(SIN(3*[.B14])+7);1) -> 235.3 | E14: of:=ROUND(3*[.C14]-[.D14];1) -> 1851.8 | F14: of:=ROUND(HARMEAN([.$B$2:.B14]);1) -> 20.5 | G14: of:=ROUND(IF([.B14]>0;LN([.B14]);SQRT(-1*[.B14]+2));1) -> 3.3
A15: 14 | B15: of:=[.B14]+1.1 -> 29 | C15: of:=ROUND([.B15]*[.B15]-3*[.B15]+1;1) -> 755 | D15: of:=ROUND(3*[.B15]*SQRT(SIN(3*[.B15])+7);1) -> 216.2 | E15: of:=ROUND(3*[.C15]-[.D15];1) -> 2048.8 | F15: of:=ROUND(HARMEAN([.$B$2:.B15]);1) -> 20.9 | G15: of:=ROUND(IF([.B15]>0;LN([.B15]);SQRT(-1*[.B15]+2));1) -> 3.4
A16: 15 | B16: of:=[.B15]+1.1 -> 30.1 | C16: of:=ROUND([.B16]*[.B16]-3*[.B16]+1;1) -> 816.7 | D16: of:=ROUND(3*[.B16]*SQRT(SIN(3*[.B16])+7);1) -> 250.9 | E16: of:=ROUND(3*[.C16]-[.D16];1) -> 2199.2 | F16: of:=ROUND(HARMEAN([.$B$2:.B16]);1) -> 21.4 | G16: of:=ROUND(IF([.B16]>0;LN([.B16]);SQRT(-1*[.B16]+2));1) -> 3.4
A17: 16 | B17: of:=[.B16]+1.1 -> 31.2 | C17: of:=ROUND([.B17]*[.B17]-3*[.B17]+1;1) -> 880.8 | D17: of:=ROUND(3*[.B17]*SQRT(SIN(3*[.B17])+7);1) -> 236.7 | E17: of:=ROUND(3*[.C17]-[.D17];1) -> 2405.7 | F17: of:=ROUND(HARMEAN([.$B$2:.B17]);1) -> 21.8 | G17: of:=ROUND(IF([.B17]>0;LN([.B17]);SQRT(-1*[.B17]+2));1) -> 3.4
A18: 17 | B18: of:=[.B17]+1.1 -> 32.3 | C18: of:=ROUND([.B18]*[.B18]-3*[.B18]+1;1) -> 947.4 | D18: of:=ROUND(3*[.B18]*SQRT(SIN(3*[.B18])+7);1) -> 264.8 | E18: of:=ROUND(3*[.C18]-[.D18];1) -> 2577.4 | F18: of:=ROUND(HARMEAN([.$B$2:.B18]);1) -> 22.2 | G18: of:=ROUND(IF([.B18]>0;LN([.B18]);SQRT(-1*[.B18]+2));1) -> 3.5
A19: 18 | B19: of:=[.B18]+1.1 -> 33.4 | C19: of:=ROUND([.B19]*[.B19]-3*[.B19]+1;1) -> 1016.4 | D19: of:=ROUND(3*[.B19]*SQRT(SIN(3*[.B19])+7);1) -> 258.9 | E19: of:=ROUND(3*[.C19]-[.D19];1) -> 2790.3 | F19: of:=ROUND(HARMEAN([.$B$2:.B19]);1) -> 22.6 | G19: of:=ROUND(IF([.B19]>0;LN([.B19]);SQRT(-1*[.B19]+2));1) -> 3.5
A20: 19 | B20: of:=[.B19]+1.1 -> 34.5 | C20: of:=ROUND([.B20]*[.B20]-3*[.B20]+1;1) -> 1087.8 | D20: of:=ROUND(3*[.B20]*SQRT(SIN(3*[.B20])+7);1) -> 277.2 | E20: of:=ROUND(3*[.C20]-[.D20];1) -> 2986.2 | F20: of:=ROUND(HARMEAN([.$B$2:.B20]);1) -> 23 | G20: of:=ROUND(IF([.B20]>0;LN([.B20]);SQRT(-1*[.B20]+2));1) -> 3.5
A21: 20 | B21: of:=[.B20]+1.1 -> 35.6 | C21: of:=ROUND([.B21]*[.B21]-3*[.B21]+1;1) -> 1161.6 | D21: of:=ROUND(3*[.B21]*SQRT(SIN(3*[.B21])+7);1) -> 282.3 | E21: of:=ROUND(3*[.C21]-[.D21];1) -> 3202.5 | F21: of:=ROUND(HARMEAN([.$B$2:.B21]);1) -> 23.5 | G21: of:=ROUND(IF([.B21]>0;LN([.B21]);SQRT(-1*[.B21]+2));1) -> 3.6
A22: 21 | B22: of:=[.B21]+1.1 -> 36.7 | C22: of:=ROUND([.B22]*[.B22]-3*[.B22]+1;1) -> 1237.8 | D22: of:=ROUND(3*[.B22]*SQRT(SIN(3*[.B22])+7);1) -> 288.3 | E22: of:=ROUND(3*[.C22]-[.D22];1) -> 3425.1 | F22: of:=ROUND(HARMEAN([.$B$2:.B22]);1) -> 23.9 | G22: of:=ROUND(IF([.B22]>0;LN([.B22]);SQRT(-1*[.B22]+2));1) -> 3.6
A23: 22 | B23: of:=[.B22]+1.1 -> 37.8 | C23: of:=ROUND([.B23]*[.B23]-3*[.B23]+1;1) -> 1316.4 | D23: of:=ROUND(3*[.B23]*SQRT(SIN(3*[.B23])+7);1) -> 306.3 | E23: of:=ROUND(3*[.C23]-[.D23];1) -> 3642.9 | F23: of:=ROUND(HARMEAN([.$B$2:.B23]);1) -> 24.3 | G23: of:=ROUND(IF([.B23]>0;LN([.B23]);SQRT(-1*[.B23]+2));1) -> 3.6
A24: 23 | B24: of:=[.B23]+1.1 -> 38.9 | C24: of:=ROUND([.B24]*[.B24]-3*[.B24]+1;1) -> 1397.5 | D24: of:=ROUND(3*[.B24]*SQRT(SIN(3*[.B24])+7);1) -> 298.8 | E24: of:=ROUND(3*[.C24]-[.D24];1) -> 3893.7 | F24: of:=ROUND(HARMEAN([.$B$2:.B24]);1) -> 24.7 | G24: of:=ROUND(IF([.B24]>0;LN([.B24]);SQRT(-1*[.B24]+2));1) -> 3.7
A25: 24 | B25: of:=[.B24]+1.1 -> 40 | C25: of:=ROUND([.B25]*[.B25]-3*[.B25]+1;1) -> 1481 | D25: of:=ROUND(3*[.B25]*SQRT(SIN(3*[.B25])+7);1) -> 330.4 | E25: of:=ROUND(3*[.C25]-[.D25];1) -> 4112.6 | F25: of:=ROUND(HARMEAN([.$B$2:.B25]);1) -> 25.1 | G25: of:=ROUND(IF([.B25]>0;LN([.B25]);SQRT(-1*[.B25]+2));1) -> 3.7
A26: 25 | B26: of:=[.B25]+1.1 -> 41.1 | C26: of:=ROUND([.B26]*[.B26]-3*[.B26]+1;1) -> 1566.9 | D26: of:=ROUND(3*[.B26]*SQRT(SIN(3*[.B26])+7);1) -> 309.4 | E26: of:=ROUND(3*[.C26]-[.D26];1) -> 4391.3 | F26: of:=ROUND(HARMEAN([.$B$2:.B26]);1) -> 25.5 | G26: of:=ROUND(IF([.B26]>0;LN([.B26]);SQRT(-1*[.B26]+2));1) -> 3.7
A27: minimum: | B27: of:=MIN([.B2:.B26]) -> 14.7 | C27: of:=MIN([.C2:.C26]) -> 173 | D27: of:=MIN([.D2:.D26]) -> 117.7 | E27: of:=MIN([.E2:.E26]) -> 401.3 | F27: of:=MIN([.F2:.F26]) -> 14.7 | G27: of:=MIN([.G2:.G26]) -> 2.7
A28: arithmetic mean: | B28: of:=AVERAGE([.B2:.B26]) -> 27.9 | C28: of:=AVERAGE([.C2:.C26]) -> 758.632 | D28: of:=AVERAGE([.D2:.D26]) -> 220.852 | E28: of:=AVERAGE([.E2:.E26]) -> 2055.044 | F28: of:=AVERAGE([.F2:.F26]) -> 20.344 | G28: of:=AVERAGE([.G2:.G26]) -> 3.284
A29: maximum: | B29: of:=MAX([.B2:.B26]) -> 41.1 | C29: of:=MAX([.C2:.C26]) -> 1566.9 | D29: of:=MAX([.D2:.D26]) -> 330.4 | E29: of:=MAX([.E2:.E26]) -> 4391.3 | F29: of:=MAX([.F2:.F26]) -> 25.5 | G29: of:=MAX([.G2:.G26]) -> 3.7

Sheet: Sheet2
A1: № | B1: x | C1: A | D1: B | E1: C | F1: D | G1: E
A2: 1 | B2: 14.7 | C2: of:=ROUND([.B2]*[.B2]-3*[.B2]+1;1) -> 173 | D2: of:=ROUND(3*[.B2]*SQRT(SIN(3*[.B2])+7);1) -> 117.7 | E2: of:=ROUND(3*[.C2]-[.D2];1) -> 401.3 | F2: of:=ROUND(HARMEAN([.$B$2:.B2]);1) -> 14.7 | G2: of:=ROUND(IF([.B2]>0;LN([.B2]);SQRT(-1*[.B2]+2));1) -> 2.7
A3: 2 | B3: of:=[.B2]+1.1 -> 15.8 | C3: of:=ROUND([.B3]*[.B3]-3*[.B3]+1;1) -> 203.2 | D3: of:=ROUND(3*[.B3]*SQRT(SIN(3*[.B3])+7);1) -> 122.9 | E3: of:=ROUND(3*[.C3]-[.D3];1) -> 486.7 | F3: of:=ROUND(HARMEAN([.$B$2:.B3]);1) -> 15.2 | G3: of:=ROUND(IF([.B3]>0;LN([.B3]);SQRT(-1*[.B3]+2));1) -> 2.8
A4: 3 | B4: of:=[.B3]+1.1 -> 16.9 | C4: of:=ROUND([.B4]*[.B4]-3*[.B4]+1;1) -> 235.9 | D4: of:=ROUND(3*[.B4]*SQRT(SIN(3*[.B4])+7);1) -> 138.1 | E4: of:=ROUND(3*[.C4]-[.D4];1) -> 569.6 | F4: of:=ROUND(HARMEAN([.$B$2:.B4]);1) -> 15.7 | G4: of:=ROUND(IF([.B4]>0;LN([.B4]);SQRT(-1*[.B4]+2));1) -> 2.8
A5: 4 | B5: of:=[.B4]+1.1 -> 18 | C5: of:=ROUND([.B5]*[.B5]-3*[.B5]+1;1) -> 271 | D5: of:=ROUND(3*[.B5]*SQRT(SIN(3*[.B5])+7);1) -> 137 | E5: of:=ROUND(3*[.C5]-[.D5];1) -> 676 | F5: of:=ROUND(HARMEAN([.$B$2:.B5]);1) -> 16.3 | G5: of:=ROUND(IF([.B5]>0;LN([.B5]);SQRT(-1*[.B5]+2));1) -> 2.9
A6: 5 | B6: of:=[.B5]+1.1 -> 19.1 | C6: of:=ROUND([.B6]*[.B6]-3*[.B6]+1;1) -> 308.5 | D6: of:=ROUND(3*[.B6]*SQRT(SIN(3*[.B6])+7);1) -> 158.8 | E6: of:=ROUND(3*[.C6]-[.D6];1) -> 766.7 | F6: of:=ROUND(HARMEAN([.$B$2:.B6]);1) -> 16.8 | G6: of:=ROUND(IF([.B6]>0;LN([.B6]);SQRT(-1*[.B6]+2));1) -> 2.9
A7: 6 | B7: of:=[.B6]+1.1 -> 20.2 | C7: of:=ROUND([.B7]*[.B7]-3*[.B7]+1;1) -> 348.4 | D7: of:=ROUND(3*[.B7]*SQRT(SIN(3*[.B7])+7);1) -> 151 | E7: of:=ROUND(3*[.C7]-[.D7];1) -> 894.2 | F7: of:=ROUND(HARMEAN([.$B$2:.B7]);1) -> 17.2 | G7: of:=ROUND(IF([.B7]>0;LN([.B7]);SQRT(-1*[.B7]+2));1) -> 3
A8: 7 | B8: of:=[.B7]+1.1 -> 21.3 | C8: of:=ROUND([.B8]*[.B8]-3*[.B8]+1;1) -> 390.8 | D8: of:=ROUND(3*[.B8]*SQRT(SIN(3*[.B8])+7);1) -> 179.3 | E8: of:=ROUND(3*[.C8]-[.D8];1) -> 993.1 | F8: of:=ROUND(HARMEAN([.$B$2:.B8]);1) -> 17.7 | G8: of:=ROUND(IF([.B8]>0;LN([.B8]);SQRT(-1*[.B8]+2));1) -> 3.1
A9: 8 | B9: of:=[.B8]+1.1 -> 22.4 | C9: of:=ROUND([.B9]*[.B9]-3*[.B9]+1;1) -> 435.6 | D9: of:=ROUND(3*[.B9]*SQRT(SIN(3*[.B9])+7);1) -> 165.4 | E9: of:=ROUND(3*[.C9]-[.D9];1) -> 1141.4 | F9: of:=ROUND(HARMEAN([.$B$2:.B9]);1) -> 18.2 | G9: of:=ROUND(IF([.B9]>0;LN([.B9]);SQRT(-1*[.B9]+2));1) -> 3.1
A10: 9 | B10: of:=[.B9]+1.1 -> 23.5 | C10: of:=ROUND([.B10]*[.B10]-3*[.B10]+1;1) -> 482.8 | D10: of:=ROUND(3*[.B10]*SQRT(SIN(3*[.B10])+7);1) -> 199.2 | E10: of:=ROUND(3*[.C10]-[.D10];1) -> 1249.2 | F10: of:=ROUND(HARMEAN([.$B$2:.B10]);1) -> 18.7 | G10: of:=ROUND(IF([.B10]>0;LN([.B10]);SQRT(-1*[.B10]+2));1) -> 3.2
A11: 10 | B11: of:=[.B10]+1.1 -> 24.6 | C11: of:=ROUND([.B11]*[.B11]-3*[.B11]+1;1) -> 532.4 | D11: of:=ROUND(3*[.B11]*SQRT(SIN(3*[.B11])+7);1) -> 180.8 | E11: of:=ROUND(3*[.C11]-[.D11];1) -> 1416.4 | F11: of:=ROUND(HARMEAN([.$B$2:.B11]);1) -> 19.1 | G11: of:=ROUND(IF([.B11]>0;LN([.B11]);SQRT(-1*[.B11]+2));1) -> 3.2
A12: 11 | B12: of:=[.B11]+1.1 -> 25.7 | C12: of:=ROUND([.B12]*[.B12]-3*[.B12]+1;1) -> 584.4 | D12: of:=ROUND(3*[.B12]*SQRT(SIN(3*[.B12])+7);1) -> 218 | E12: of:=ROUND(3*[.C12]-[.D12];1) -> 1535.2 | F12: of:=ROUND(HARMEAN([.$B$2:.B12]);1) -> 19.6 | G12: of:=ROUND(IF([.B12]>0;LN([.B12]);SQRT(-1*[.B12]+2));1) -> 3.2
A13: 12 | B13: of:=[.B12]+1.1 -> 26.8 | C13: of:=ROUND([.B13]*[.B13]-3*[.B13]+1;1) -> 638.8 | D13: of:=ROUND(3*[.B13]*SQRT(SIN(3*[.B13])+7);1) -> 197.6 | E13: of:=ROUND(3*[.C13]-[.D13];1) -> 1718.8 | F13: of:=ROUND(HARMEAN([.$B$2:.B13]);1) -> 20 | G13: of:=ROUND(IF([.B13]>0;LN([.B13]);SQRT(-1*[.B13]+2));1) -> 3.3
A14: 13 | B14: of:=[.B13]+1.1 -> 27.9 | C14: of:=ROUND([.B14]*[.B14]-3*[.B14]+1;1) -> 695.7 | D14: of:=ROUND(3*[.B14]*SQRT(SIN(3*[.B14])+7);1) -> 235.3 | E14: of:=ROUND(3*[.C14]-[.D14];1) -> 1851.8 | F14: of:=ROUND(HARMEAN([.$B$2:.B14]);1) -> 20.5 | G14: of:=ROUND(IF([.B14]>0;LN([.B14]);SQRT(-1*[.B14]+2));1) -> 3.3
A15: 14 | B15: of:=[.B14]+1.1 -> 29 | C15: of:=ROUND([.B15]*[.B15]-3*[.B15]+1;1) -> 755 | D15: of:=ROUND(3*[.B15]*SQRT(SIN(3*[.B15])+7);1) -> 216.2 | E15: of:=ROUND(3*[.C15]-[.D15];1) -> 2048.8 | F15: of:=ROUND(HARMEAN([.$B$2:.B15]);1) -> 20.9 | G15: of:=ROUND(IF([.B15]>0;LN([.B15]);SQRT(-1*[.B15]+2));1) -> 3.4
A16: 15 | B16: of:=[.B15]+1.1 -> 30.1 | C16: of:=ROUND([.B16]*[.B16]-3*[.B16]+1;1) -> 816.7 | D16: of:=ROUND(3*[.B16]*SQRT(SIN(3*[.B16])+7);1) -> 250.9 | E16: of:=ROUND(3*[.C16]-[.D16];1) -> 2199.2 | F16: of:=ROUND(HARMEAN([.$B$2:.B16]);1) -> 21.4 | G16: of:=ROUND(IF([.B16]>0;LN([.B16]);SQRT(-1*[.B16]+2));1) -> 3.4
A17: 16 | B17: of:=[.B16]+1.1 -> 31.2 | C17: of:=ROUND([.B17]*[.B17]-3*[.B17]+1;1) -> 880.8 | D17: of:=ROUND(3*[.B17]*SQRT(SIN(3*[.B17])+7);1) -> 236.7 | E17: of:=ROUND(3*[.C17]-[.D17];1) -> 2405.7 | F17: of:=ROUND(HARMEAN([.$B$2:.B17]);1) -> 21.8 | G17: of:=ROUND(IF([.B17]>0;LN([.B17]);SQRT(-1*[.B17]+2));1) -> 3.4
A18: 17 | B18: of:=[.B17]+1.1 -> 32.3 | C18: of:=ROUND([.B18]*[.B18]-3*[.B18]+1;1) -> 947.4 | D18: of:=ROUND(3*[.B18]*SQRT(SIN(3*[.B18])+7);1) -> 264.8 | E18: of:=ROUND(3*[.C18]-[.D18];1) -> 2577.4 | F18: of:=ROUND(HARMEAN([.$B$2:.B18]);1) -> 22.2 | G18: of:=ROUND(IF([.B18]>0;LN([.B18]);SQRT(-1*[.B18]+2));1) -> 3.5
A19: 18 | B19: of:=[.B18]+1.1 -> 33.4 | C19: of:=ROUND([.B19]*[.B19]-3*[.B19]+1;1) -> 1016.4 | D19: of:=ROUND(3*[.B19]*SQRT(SIN(3*[.B19])+7);1) -> 258.9 | E19: of:=ROUND(3*[.C19]-[.D19];1) -> 2790.3 | F19: of:=ROUND(HARMEAN([.$B$2:.B19]);1) -> 22.6 | G19: of:=ROUND(IF([.B19]>0;LN([.B19]);SQRT(-1*[.B19]+2));1) -> 3.5
A20: 19 | B20: of:=[.B19]+1.1 -> 34.5 | C20: of:=ROUND([.B20]*[.B20]-3*[.B20]+1;1) -> 1087.8 | D20: of:=ROUND(3*[.B20]*SQRT(SIN(3*[.B20])+7);1) -> 277.2 | E20: of:=ROUND(3*[.C20]-[.D20];1) -> 2986.2 | F20: of:=ROUND(HARMEAN([.$B$2:.B20]);1) -> 23 | G20: of:=ROUND(IF([.B20]>0;LN([.B20]);SQRT(-1*[.B20]+2));1) -> 3.5
A21: 20 | B21: of:=[.B20]+1.1 -> 35.6 | C21: of:=ROUND([.B21]*[.B21]-3*[.B21]+1;1) -> 1161.6 | D21: of:=ROUND(3*[.B21]*SQRT(SIN(3*[.B21])+7);1) -> 282.3 | E21: of:=ROUND(3*[.C21]-[.D21];1) -> 3202.5 | F21: of:=ROUND(HARMEAN([.$B$2:.B21]);1) -> 23.5 | G21: of:=ROUND(IF([.B21]>0;LN([.B21]);SQRT(-1*[.B21]+2));1) -> 3.6
A22: 21 | B22: of:=[.B21]+1.1 -> 36.7 | C22: of:=ROUND([.B22]*[.B22]-3*[.B22]+1;1) -> 1237.8 | D22: of:=ROUND(3*[.B22]*SQRT(SIN(3*[.B22])+7);1) -> 288.3 | E22: of:=ROUND(3*[.C22]-[.D22];1) -> 3425.1 | F22: of:=ROUND(HARMEAN([.$B$2:.B22]);1) -> 23.9 | G22: of:=ROUND(IF([.B22]>0;LN([.B22]);SQRT(-1*[.B22]+2));1) -> 3.6
A23: 22 | B23: of:=[.B22]+1.1 -> 37.8 | C23: of:=ROUND([.B23]*[.B23]-3*[.B23]+1;1) -> 1316.4 | D23: of:=ROUND(3*[.B23]*SQRT(SIN(3*[.B23])+7);1) -> 306.3 | E23: of:=ROUND(3*[.C23]-[.D23];1) -> 3642.9 | F23: of:=ROUND(HARMEAN([.$B$2:.B23]);1) -> 24.3 | G23: of:=ROUND(IF([.B23]>0;LN([.B23]);SQRT(-1*[.B23]+2));1) -> 3.6
A24: 23 | B24: of:=[.B23]+1.1 -> 38.9 | C24: of:=ROUND([.B24]*[.B24]-3*[.B24]+1;1) -> 1397.5 | D24: of:=ROUND(3*[.B24]*SQRT(SIN(3*[.B24])+7);1) -> 298.8 | E24: of:=ROUND(3*[.C24]-[.D24];1) -> 3893.7 | F24: of:=ROUND(HARMEAN([.$B$2:.B24]);1) -> 24.7 | G24: of:=ROUND(IF([.B24]>0;LN([.B24]);SQRT(-1*[.B24]+2));1) -> 3.7
A25: 24 | B25: of:=[.B24]+1.1 -> 40 | C25: of:=ROUND([.B25]*[.B25]-3*[.B25]+1;1) -> 1481 | D25: of:=ROUND(3*[.B25]*SQRT(SIN(3*[.B25])+7);1) -> 330.4 | E25: of:=ROUND(3*[.C25]-[.D25];1) -> 4112.6 | F25: of:=ROUND(HARMEAN([.$B$2:.B25]);1) -> 25.1 | G25: of:=ROUND(IF([.B25]>0;LN([.B25]);SQRT(-1*[.B25]+2));1) -> 3.7
A26: 25 | B26: of:=[.B25]+1.1 -> 41.1 | C26: of:=ROUND([.B26]*[.B26]-3*[.B26]+1;1) -> 1566.9 | D26: of:=ROUND(3*[.B26]*SQRT(SIN(3*[.B26])+7);1) -> 309.4 | E26: of:=ROUND(3*[.C26]-[.D26];1) -> 4391.3 | F26: of:=ROUND(HARMEAN([.$B$2:.B26]);1) -> 25.5 | G26: of:=ROUND(IF([.B26]>0;LN([.B26]);SQRT(-1*[.B26]+2));1) -> 3.7
A27: minimum: | B27: of:=MIN([.B2:.B26]) -> 14.7 | C27: of:=MIN([.C2:.C26]) -> 173 | D27: of:=MIN([.D2:.D26]) -> 117.7 | E27: of:=MIN([.E2:.E26]) -> 401.3 | F27: of:=MIN([.F2:.F26]) -> 14.7 | G27: of:=MIN([.G2:.G26]) -> 2.7
A28: arithmetic mean: | B28: of:=AVERAGE([.B2:.B26]) -> 27.9 | C28: of:=AVERAGE([.C2:.C26]) -> 758.632 | D28: of:=AVERAGE([.D2:.D26]) -> 220.852 | E28: of:=AVERAGE([.E2:.E26]) -> 2055.044 | F28: of:=AVERAGE([.F2:.F26]) -> 20.344 | G28: of:=AVERAGE([.G2:.G26]) -> 3.284
A29: maximum: | B29: of:=MAX([.B2:.B26]) -> 41.1 | C29: of:=MAX([.C2:.C26]) -> 1566.9 | D29: of:=MAX([.D2:.D26]) -> 330.4 | E29: of:=MAX([.E2:.E26]) -> 4391.3 | F29: of:=MAX([.F2:.F26]) -> 25.5 | G29: of:=MAX([.G2:.G26]) -> 3.7

Sheet: Sheet3
A1: № | B1: 1 | C1: 2 | D1: 3 | E1: 4 | F1: 5 | G1: 6 | H1: 7 | I1: 8 | J1: 9 | K1: 10 | L1: 11 | M1: 12 | N1: 13 | O1: 14 | P1: 15 | Q1: 16 | R1: 17 | S1: 18 | T1: 19 | U1: 20 | V1: 21 | W1: 22 | X1: 23 | Y1: 24 | Z1: 25 | AA1: minimum: | AB1: arithmetic mean: | AC1: maximum:
A2: x | B2: 14.7 | C2: of:=[.B2]+1.1 -> 15.8 | D2: of:=[.C2]+1.1 -> 16.9 | E2: of:=[.D2]+1.1 -> 18 | F2: of:=[.E2]+1.1 -> 19.1 | G2: of:=[.F2]+1.1 -> 20.2 | H2: of:=[.G2]+1.1 -> 21.3 | I2: of:=[.H2]+1.1 -> 22.4 | J2: of:=[.I2]+1.1 -> 23.5 | K2: of:=[.J2]+1.1 -> 24.6 | L2: of:=[.K2]+1.1 -> 25.7 | M2: of:=[.L2]+1.1 -> 26.8 | N2: of:=[.M2]+1.1 -> 27.9 | O2: of:=[.N2]+1.1 -> 29 | P2: of:=[.O2]+1.1 -> 30.1 | Q2: of:=[.P2]+1.1 -> 31.2 | R2: of:=[.Q2]+1.1 -> 32.3 | S2: of:=[.R2]+1.1 -> 33.4 | T2: of:=[.S2]+1.1 -> 34.5 | U2: of:=[.T2]+1.1 -> 35.6 | V2: of:=[.U2]+1.1 -> 36.7 | W2: of:=[.V2]+1.1 -> 37.8 | X2: of:=[.W2]+1.1 -> 38.9 | Y2: of:=[.X2]+1.1 -> 40 | Z2: of:=[.Y2]+1.1 -> 41.1 | AA2: of:=MIN([.B2:.Z2]) -> 14.7 | AB2: of:=AVERAGE([.B2:.Z2]) -> 27.9 | AC2: of:=MAX([.B2:.Z2]) -> 41.1
A3: A | B3: of:=ROUND([.B2]*[.B2]-3*[.B2]+1;1) -> 173 | C3: of:=ROUND([.C2]*[.C2]-3*[.C2]+1;1) -> 203.2 | D3: of:=ROUND([.D2]*[.D2]-3*[.D2]+1;1) -> 235.9 | E3: of:=ROUND([.E2]*[.E2]-3*[.E2]+1;1) -> 271 | F3: of:=ROUND([.F2]*[.F2]-3*[.F2]+1;1) -> 308.5 | G3: of:=ROUND([.G2]*[.G2]-3*[.G2]+1;1) -> 348.4 | H3: of:=ROUND([.H2]*[.H2]-3*[.H2]+1;1) -> 390.8 | I3: of:=ROUND([.I2]*[.I2]-3*[.I2]+1;1) -> 435.6 | J3: of:=ROUND([.J2]*[.J2]-3*[.J2]+1;1) -> 482.8 | K3: of:=ROUND([.K2]*[.K2]-3*[.K2]+1;1) -> 532.4 | L3: of:=ROUND([.L2]*[.L2]-3*[.L2]+1;1) -> 584.4 | M3: of:=ROUND([.M2]*[.M2]-3*[.M2]+1;1) -> 638.8 | N3: of:=ROUND([.N2]*[.N2]-3*[.N2]+1;1) -> 695.7 | O3: of:=ROUND([.O2]*[.O2]-3*[.O2]+1;1) -> 755 | P3: of:=ROUND([.P2]*[.P2]-3*[.P2]+1;1) -> 816.7 | Q3: of:=ROUND([.Q2]*[.Q2]-3*[.Q2]+1;1) -> 880.8 | R3: of:=ROUND([.R2]*[.R2]-3*[.R2]+1;1) -> 947.4 | S3: of:=ROUND([.S2]*[.S2]-3*[.S2]+1;1) -> 1016.4 | T3: of:=ROUND([.T2]*[.T2]-3*[.T2]+1;1) -> 1087.8 | U3: of:=ROUND([.U2]*[.U2]-3*[.U2]+1;1) -> 1161.6 | V3: of:=ROUND([.V2]*[.V2]-3*[.V2]+1;1) -> 1237.8 | W3: of:=ROUND([.W2]*[.W2]-3*[.W2]+1;1) -> 1316.4 | X3: of:=ROUND([.X2]*[.X2]-3*[.X2]+1;1) -> 1397.5 | Y3: of:=ROUND([.Y2]*[.Y2]-3*[.Y2]+1;1) -> 1481 | Z3: of:=ROUND([.Z2]*[.Z2]-3*[.Z2]+1;1) -> 1566.9 | AA3: of:=MIN([.B3:.Z3]) -> 173 | AB3: of:=AVERAGE([.B3:.Z3]) -> 758.632 | AC3: of:=MAX([.B3:.Z3]) -> 1566.9
A4: B | B4: of:=ROUND(3*[.B2]*SQRT(SIN(3*[.B2])+7);1) -> 117.7 | C4: of:=ROUND(3*[.C2]*SQRT(SIN(3*[.C2])+7);1) -> 122.9 | D4: of:=ROUND(3*[.D2]*SQRT(SIN(3*[.D2])+7);1) -> 138.1 | E4: of:=ROUND(3*[.E2]*SQRT(SIN(3*[.E2])+7);1) -> 137 | F4: of:=ROUND(3*[.F2]*SQRT(SIN(3*[.F2])+7);1) -> 158.8 | G4: of:=ROUND(3*[.G2]*SQRT(SIN(3*[.G2])+7);1) -> 151 | H4: of:=ROUND(3*[.H2]*SQRT(SIN(3*[.H2])+7);1) -> 179.3 | I4: of:=ROUND(3*[.I2]*SQRT(SIN(3*[.I2])+7);1) -> 165.4 | J4: of:=ROUND(3*[.J2]*SQRT(SIN(3*[.J2])+7);1) -> 199.2 | K4: of:=ROUND(3*[.K2]*SQRT(SIN(3*[.K2])+7);1) -> 180.8 | L4: of:=ROUND(3*[.L2]*SQRT(SIN(3*[.L2])+7);1) -> 218 | M4: of:=ROUND(3*[.M2]*SQRT(SIN(3*[.M2])+7);1) -> 197.6 | N4: of:=ROUND(3*[.N2]*SQRT(SIN(3*[.N2])+7);1) -> 235.3 | O4: of:=ROUND(3*[.O2]*SQRT(SIN(3*[.O2])+7);1) -> 216.2 | P4: of:=ROUND(3*[.P2]*SQRT(SIN(3*[.P2])+7);1) -> 250.9 | Q4: of:=ROUND(3*[.Q2]*SQRT(SIN(3*[.Q2])+7);1) -> 236.7 | R4: of:=ROUND(3*[.R2]*SQRT(SIN(3*[.R2])+7);1) -> 264.8 | S4: of:=ROUND(3*[.S2]*SQRT(SIN(3*[.S2])+7);1) -> 258.9 | T4: of:=ROUND(3*[.T2]*SQRT(SIN(3*[.T2])+7);1) -> 277.2 | U4: of:=ROUND(3*[.U2]*SQRT(SIN(3*[.U2])+7);1) -> 282.3 | V4: of:=ROUND(3*[.V2]*SQRT(SIN(3*[.V2])+7);1) -> 288.3 | W4: of:=ROUND(3*[.W2]*SQRT(SIN(3*[.W2])+7);1) -> 306.3 | X4: of:=ROUND(3*[.X2]*SQRT(SIN(3*[.X2])+7);1) -> 298.8 | Y4: of:=ROUND(3*[.Y2]*SQRT(SIN(3*[.Y2])+7);1) -> 330.4 | Z4: of:=ROUND(3*[.Z2]*SQRT(SIN(3*[.Z2])+7);1) -> 309.4 | AA4: of:=MIN([.B4:.Z4]) -> 117.7 | AB4: of:=AVERAGE([.B4:.Z4]) -> 220.852 | AC4: of:=MAX([.B4:.Z4]) -> 330.4
A5: C | B5: of:=ROUND(3*[.B3]-[.B4];1) -> 401.3 | C5: of:=ROUND(3*[.C3]-[.C4];1) -> 486.7 | D5: of:=ROUND(3*[.D3]-[.D4];1) -> 569.6 | E5: of:=ROUND(3*[.E3]-[.E4];1) -> 676 | F5: of:=ROUND(3*[.F3]-[.F4];1) -> 766.7 | G5: of:=ROUND(3*[.G3]-[.G4];1) -> 894.2 | H5: of:=ROUND(3*[.H3]-[.H4];1) -> 993.1 | I5: of:=ROUND(3*[.I3]-[.I4];1) -> 1141.4 | J5: of:=ROUND(3*[.J3]-[.J4];1) -> 1249.2 | K5: of:=ROUND(3*[.K3]-[.K4];1) -> 1416.4 | L5: of:=ROUND(3*[.L3]-[.L4];1) -> 1535.2 | M5: of:=ROUND(3*[.M3]-[.M4];1) -> 1718.8 | N5: of:=ROUND(3*[.N3]-[.N4];1) -> 1851.8 | O5: of:=ROUND(3*[.O3]-[.O4];1) -> 2048.8 | P5: of:=ROUND(3*[.P3]-[.P4];1) -> 2199.2 | Q5: of:=ROUND(3*[.Q3]-[.Q4];1) -> 2405.7 | R5: of:=ROUND(3*[.R3]-[.R4];1) -> 2577.4 | S5: of:=ROUND(3*[.S3]-[.S4];1) -> 2790.3 | T5: of:=ROUND(3*[.T3]-[.T4];1) -> 2986.2 | U5: of:=ROUND(3*[.U3]-[.U4];1) -> 3202.5 | V5: of:=ROUND(3*[.V3]-[.V4];1) -> 3425.1 | W5: of:=ROUND(3*[.W3]-[.W4];1) -> 3642.9 | X5: of:=ROUND(3*[.X3]-[.X4];1) -> 3893.7 | Y5: of:=ROUND(3*[.Y3]-[.Y4];1) -> 4112.6 | Z5: of:=ROUND(3*[.Z3]-[.Z4];1) -> 4391.3 | AA5: of:=MIN([.B5:.Z5]) -> 401.3 | AB5: of:=AVERAGE([.B5:.Z5]) -> 2055.044 | AC5: of:=MAX([.B5:.Z5]) -> 4391.3
A6: D | B6: of:=ROUND(HARMEAN([.$B$2:.B$2]);1) -> 14.7 | C6: of:=ROUND(HARMEAN([.$B$2:.C$2]);1) -> 15.2 | D6: of:=ROUND(HARMEAN([.$B$2:.D$2]);1) -> 15.7 | E6: of:=ROUND(HARMEAN([.$B$2:.E$2]);1) -> 16.3 | F6: of:=ROUND(HARMEAN([.$B$2:.F$2]);1) -> 16.8 | G6: of:=ROUND(HARMEAN([.$B$2:.G$2]);1) -> 17.2 | H6: of:=ROUND(HARMEAN([.$B$2:.H$2]);1) -> 17.7 | I6: of:=ROUND(HARMEAN([.$B$2:.I$2]);1) -> 18.2 | J6: of:=ROUND(HARMEAN([.$B$2:.J$2]);1) -> 18.7 | K6: of:=ROUND(HARMEAN([.$B$2:.K$2]);1) -> 19.1 | L6: of:=ROUND(HARMEAN([.$B$2:.L$2]);1) -> 19.6 | M6: of:=ROUND(HARMEAN([.$B$2:.M$2]);1) -> 20 | N6: of:=ROUND(HARMEAN([.$B$2:.N$2]);1) -> 20.5 | O6: of:=ROUND(HARMEAN([.$B$2:.O$2]);1) -> 20.9 | P6: of:=ROUND(HARMEAN([.$B$2:.P$2]);1) -> 21.4 | Q6: of:=ROUND(HARMEAN([.$B$2:.Q$2]);1) -> 21.8 | R6: of:=ROUND(HARMEAN([.$B$2:.R$2]);1) -> 22.2 | S6: of:=ROUND(HARMEAN([.$B$2:.S$2]);1) -> 22.6 | T6: of:=ROUND(HARMEAN([.$B$2:.T$2]);1) -> 23 | U6: of:=ROUND(HARMEAN([.$B$2:.U$2]);1) -> 23.5 | V6: of:=ROUND(HARMEAN([.$B$2:.V$2]);1) -> 23.9 | W6: of:=ROUND(HARMEAN([.$B$2:.W$2]);1) -> 24.3 | X6: of:=ROUND(HARMEAN([.$B$2:.X$2]);1) -> 24.7 | Y6: of:=ROUND(HARMEAN([.$B$2:.Y$2]);1) -> 25.1 | Z6: of:=ROUND(HARMEAN([.$B$2:.Z$2]);1) -> 25.5 | AA6: of:=MIN([.B6:.Z6]) -> 14.7 | AB6: of:=AVERAGE([.B6:.Z6]) -> 20.344 | AC6: of:=MAX([.B6:.Z6]) -> 25.5
A7: E | B7: of:=ROUND(IF([.B2]>0;LN([.B2]);SQRT(-1*[.B2]+2));1) -> 2.7 | C7: of:=ROUND(IF([.C2]>0;LN([.C2]);SQRT(-1*[.C2]+2));1) -> 2.8 | D7: of:=ROUND(IF([.D2]>0;LN([.D2]);SQRT(-1*[.D2]+2));1) -> 2.8 | E7: of:=ROUND(IF([.E2]>0;LN([.E2]);SQRT(-1*[.E2]+2));1) -> 2.9 | F7: of:=ROUND(IF([.F2]>0;LN([.F2]);SQRT(-1*[.F2]+2));1) -> 2.9 | G7: of:=ROUND(IF([.G2]>0;LN([.G2]);SQRT(-1*[.G2]+2));1) -> 3 | H7: of:=ROUND(IF([.H2]>0;LN([.H2]);SQRT(-1*[.H2]+2));1) -> 3.1 | I7: of:=ROUND(IF([.I2]>0;LN([.I2]);SQRT(-1*[.I2]+2));1) -> 3.1 | J7: of:=ROUND(IF([.J2]>0;LN([.J2]);SQRT(-1*[.J2]+2));1) -> 3.2 | K7: of:=ROUND(IF([.K2]>0;LN([.K2]);SQRT(-1*[.K2]+2));1) -> 3.2 | L7: of:=ROUND(IF([.L2]>0;LN([.L2]);SQRT(-1*[.L2]+2));1) -> 3.2 | M7: of:=ROUND(IF([.M2]>0;LN([.M2]);SQRT(-1*[.M2]+2));1) -> 3.3 | N7: of:=ROUND(IF([.N2]>0;LN([.N2]);SQRT(-1*[.N2]+2));1) -> 3.3 | O7: of:=ROUND(IF([.O2]>0;LN([.O2]);SQRT(-1*[.O2]+2));1) -> 3.4 | P7: of:=ROUND(IF([.P2]>0;LN([.P2]);SQRT(-1*[.P2]+2));1) -> 3.4 | Q7: of:=ROUND(IF([.Q2]>0;LN([.Q2]);SQRT(-1*[.Q2]+2));1) -> 3.4 | R7: of:=ROUND(IF([.R2]>0;LN([.R2]);SQRT(-1*[.R2]+2));1) -> 3.5 | S7: of:=ROUND(IF([.S2]>0;LN([.S2]);SQRT(-1*[.S2]+2));1) -> 3.5 | T7: of:=ROUND(IF([.T2]>0;LN([.T2]);SQRT(-1*[.T2]+2));1) -> 3.5 | U7: of:=ROUND(IF([.U2]>0;LN([.U2]);SQRT(-1*[.U2]+2));1) -> 3.6 | V7: of:=ROUND(IF([.V2]>0;LN([.V2]);SQRT(-1*[.V2]+2));1) -> 3.6 | W7: of:=ROUND(IF([.W2]>0;LN([.W2]);SQRT(-1*[.W2]+2));1) -> 3.6 | X7: of:=ROUND(IF([.X2]>0;LN([.X2]);SQRT(-1*[.X2]+2));1) -> 3.7 | Y7: of:=ROUND(IF([.Y2]>0;LN([.Y2]);SQRT(-1*[.Y2]+2));1) -> 3.7 | Z7: of:=ROUND(IF([.Z2]>0;LN([.Z2]);SQRT(-1*[.Z2]+2));1) -> 3.7 | AA7: of:=MIN([.B7:.Z7]) -> 2.7 | AB7: of:=AVERAGE([.B7:.Z7]) -> 3.284 | AC7: of:=MAX([.B7:.Z7]) -> 3.7

Sheet: Sheet4
A1: № | B1: x | C1: A | D1: B | E1: C | F1: D | G1: E
A2: 1 | B2: 14.7 | C2: 173 | D2: 117.7 | E2: 401.3 | F2: 14.7 | G2: 2.7
A3: minimum: | B3: 14.7 | C3: 173 | D3: 117.7 | E3: 401.3 | F3: 14.7 | G3: 2.7
A4: 2 | B4: 15.8 | C4: 203.2 | D4: 122.9 | E4: 486.7 | F4: 15.2 | G4: 2.8
A5: 3 | B5: 16.9 | C5: 235.9 | D5: 138.1 | E5: 569.6 | F5: 15.7 | G5: 2.8
A6: 4 | B6: 18 | C6: 271 | D6: 137 | E6: 676 | F6: 16.3 | G6: 2.9
A7: 5 | B7: 19.1 | C7: 308.5 | D7: 158.8 | E7: 766.7 | F7: 16.8 | G7: 2.9
A8: 6 | B8: 20.2 | C8: 348.4 | D8: 151 | E8: 894.2 | F8: 17.2 | G8: 3
A9: 7 | B9: 21.3 | C9: 390.8 | D9: 179.3 | E9: 993.1 | F9: 17.7 | G9: 3.1
A10: 8 | B10: 22.4 | C10: 435.6 | D10: 165.4 | E10: 1141.4 | F10: 18.2 | G10: 3.1
A11: 9 | B11: 23.5 | C11: 482.8 | D11: 199.2 | E11: 1249.2 | F11: 18.7 | G11: 3.2
A12: 10 | B12: 24.6 | C12: 532.4 | D12: 180.8 | E12: 1416.4 | F12: 19.1 | G12: 3.2
A13: 11 | B13: 25.7 | C13: 584.4 | D13: 218 | E13: 1535.2 | F13: 19.6 | G13: 3.2
A14: arithmetic mean: | B14: 27.9 | C14: 758.632 | D14: 220.852 | E14: 2055.044 | F14: 20.344 | G14: 3.284
A15: 12 | B15: 26.8 | C15: 638.8 | D15: 197.6 | E15: 1718.8 | F15: 20 | G15: 3.3
A16: 13 | B16: 27.9 | C16: 695.7 | D16: 235.3 | E16: 1851.8 | F16: 20.5 | G16: 3.3
A17: 14 | B17: 29 | C17: 755 | D17: 216.2 | E17: 2048.8 | F17: 20.9 | G17: 3.4
A18: 15 | B18: 30.1 | C18: 816.7 | D18: 250.9 | E18: 2199.2 | F18: 21.4 | G18: 3.4
A19: 16 | B19: 31.2 | C19: 880.8 | D19: 236.7 | E19: 2405.7 | F19: 21.8 | G19: 3.4
A20: 17 | B20: 32.3 | C20: 947.4 | D20: 264.8 | E20: 2577.4 | F20: 22.2 | G20: 3.5
A21: 18 | B21: 33.4 | C21: 1016.4 | D21: 258.9 | E21: 2790.3 | F21: 22.6 | G21: 3.5
A22: 19 | B22: 34.5 | C22: 1087.8 | D22: 277.2 | E22: 2986.2 | F22: 23 | G22: 3.5
A23: 20 | B23: 35.6 | C23: 1161.6 | D23: 282.3 | E23: 3202.5 | F23: 23.5 | G23: 3.6
A24: 21 | B24: 36.7 | C24: 1237.8 | D24: 288.3 | E24: 3425.1 | F24: 23.9 | G24: 3.6
A25: 22 | B25: 37.8 | C25: 1316.4 | D25: 306.3 | E25: 3642.9 | F25: 24.3 | G25: 3.6
A26: 23 | B26: 38.9 | C26: 1397.5 | D26: 298.8 | E26: 3893.7 | F26: 24.7 | G26: 3.7
A27: 24 | B27: 40 | C27: 1481 | D27: 330.4 | E27: 4112.6 | F27: 25.1 | G27: 3.7
A28: 25 | B28: 41.1 | C28: 1566.9 | D28: 309.4 | E28: 4391.3 | F28: 25.5 | G28: 3.7
A29: maximum: | B29: 41.1 | C29: 1566.9 | D29: 330.4 | E29: 4391.3 | F29: 25.5 | G29: 3.7

Sheet: Sheet5
A1: № | B1: x | C1: A | D1: B | E1: C | F1: D | G1: E
A2: 1 | B2: -2.8 | C2: of:=ROUND(SIN([.B2])-3*POWER([.B2]; 1/3);1) -> 3.9 | D2: of:=ROUND(-1*POWER([.B2]; 2)*COS(3*SQRT(ABS([.B2])));1) -> -2.4 | E2: of:=ROUND(SQRT(POWER([.C2]; 2)+10);1) -> 5 | F2: of:=ROUND(MIN([.$B$2:.B2]);1) -> -2.8 | G2: of:=ROUND(IF([.B2]>AVERAGE([.B2:.B26]);2*[.B2]-3;-1*3*[.B2]+2);1) -> -8.6
A3: 2 | B3: of:=[.B2]+(-1) -> -3.8 | C3: of:=ROUND(SIN([.B3])-3*POWER([.B3]; 1/3);1) -> 5.3 | D3: of:=ROUND(-1*POWER([.B3]; 2)*COS(3*SQRT(ABS([.B3])));1) -> -13.1 | E3: of:=ROUND(SQRT(POWER([.C3]; 2)+10);1) -> 6.2 | F3: of:=ROUND(MIN([.$B$2:.B3]);1) -> -3.8 | G3: of:=ROUND(IF([.B3]>AVERAGE([.B3:.B27]);2*[.B3]-3;-1*3*[.B3]+2);1) -> -10.6
A4: 3 | B4: of:=[.B3]+(-1) -> -4.8 | C4: of:=ROUND(SIN([.B4])-3*POWER([.B4]; 1/3);1) -> 6.1 | D4: of:=ROUND(-1*POWER([.B4]; 2)*COS(3*SQRT(ABS([.B4])));1) -> -22.1 | E4: of:=ROUND(SQRT(POWER([.C4]; 2)+10);1) -> 6.9 | F4: of:=ROUND(MIN([.$B$2:.B4]);1) -> -4.8 | G4: of:=ROUND(IF([.B4]>AVERAGE([.B4:.B28]);2*[.B4]-3;-1*3*[.B4]+2);1) -> -12.6
A5: 4 | B5: of:=[.B4]+(-1) -> -5.8 | C5: of:=ROUND(SIN([.B5])-3*POWER([.B5]; 1/3);1) -> 5.9 | D5: of:=ROUND(-1*POWER([.B5]; 2)*COS(3*SQRT(ABS([.B5])));1) -> -19.8 | E5: of:=ROUND(SQRT(POWER([.C5]; 2)+10);1) -> 6.7 | F5: of:=ROUND(MIN([.$B$2:.B5]);1) -> -5.8 | G5: of:=ROUND(IF([.B5]>AVERAGE([.B5:.B29]);2*[.B5]-3;-1*3*[.B5]+2);1) -> -14.6
A6: 5 | B6: of:=[.B5]+(-1) -> -6.8 | C6: of:=ROUND(SIN([.B6])-3*POWER([.B6]; 1/3);1) -> 5.2 | D6: of:=ROUND(-1*POWER([.B6]; 2)*COS(3*SQRT(ABS([.B6])));1) -> -1.4 | E6: of:=ROUND(SQRT(POWER([.C6]; 2)+10);1) -> 6.1 | F6: of:=ROUND(MIN([.$B$2:.B6]);1) -> -6.8 | G6: of:=ROUND(IF([.B6]>AVERAGE([.B6:.B30]);2*[.B6]-3;-1*3*[.B6]+2);1) -> -16.6
A7: 6 | B7: of:=[.B6]+(-1) -> -7.8 | C7: of:=ROUND(SIN([.B7])-3*POWER([.B7]; 1/3);1) -> 5 | D7: of:=ROUND(-1*POWER([.B7]; 2)*COS(3*SQRT(ABS([.B7])));1) -> 30.5 | E7: of:=ROUND(SQRT(POWER([.C7]; 2)+10);1) -> 5.9 | F7: of:=ROUND(MIN([.$B$2:.B7]);1) -> -7.8 | G7: of:=ROUND(IF([.B7]>AVERAGE([.B7:.B31]);2*[.B7]-3;-1*3*[.B7]+2);1) -> -18.6
A8: 7 | B8: of:=[.B7]+(-1) -> -8.8 | C8: of:=ROUND(SIN([.B8])-3*POWER([.B8]; 1/3);1) -> 5.6 | D8: of:=ROUND(-1*POWER([.B8]; 2)*COS(3*SQRT(ABS([.B8])));1) -> 67 | E8: of:=ROUND(SQRT(POWER([.C8]; 2)+10);1) -> 6.4 | F8: of:=ROUND(MIN([.$B$2:.B8]);1) -> -8.8 | G8: of:=ROUND(IF([.B8]>AVERAGE([.B8:.B32]);2*[.B8]-3;-1*3*[.B8]+2);1) -> -20.6
A9: 8 | B9: of:=[.B8]+(-1) -> -9.8 | C9: of:=ROUND(SIN([.B9])-3*POWER([.B9]; 1/3);1) -> 6.8 | D9: of:=ROUND(-1*POWER([.B9]; 2)*COS(3*SQRT(ABS([.B9])));1) -> 96 | E9: of:=ROUND(SQRT(POWER([.C9]; 2)+10);1) -> 7.5 | F9: of:=ROUND(MIN([.$B$2:.B9]);1) -> -9.8 | G9: of:=ROUND(IF([.B9]>AVERAGE([.B9:.B33]);2*[.B9]-3;-1*3*[.B9]+2);1) -> -22.6
A10: 9 | B10: of:=[.B9]+(-1) -> -10.8 | C10: of:=ROUND(SIN([.B10])-3*POWER([.B10]; 1/3);1) -> 7.6 | D10: of:=ROUND(-1*POWER([.B10]; 2)*COS(3*SQRT(ABS([.B10])));1) -> 105.8 | E10: of:=ROUND(SQRT(POWER([.C10]; 2)+10);1) -> 8.2 | F10: of:=ROUND(MIN([.$B$2:.B10]);1) -> -10.8 | G10: of:=ROUND(IF([.B10]>AVERAGE([.B10:.B34]);2*[.B10]-3;-1*3*[.B10]+2);1) -> -24.6
A11: 10 | B11: of:=[.B10]+(-1) -> -11.8 | C11: of:=ROUND(SIN([.B11])-3*POWER([.B11]; 1/3);1) -> 7.5 | D11: of:=ROUND(-1*POWER([.B11]; 2)*COS(3*SQRT(ABS([.B11])));1) -> 88.7 | E11: of:=ROUND(SQRT(POWER([.C11]; 2)+10);1) -> 8.1 | F11: of:=ROUND(MIN([.$B$2:.B11]);1) -> -11.8 | G11: of:=ROUND(IF([.B11]>AVERAGE([.B11:.B35]);2*[.B11]-3;-1*3*[.B11]+2);1) -> -26.6
A12: 11 | B12: of:=[.B11]+(-1) -> -12.8 | C12: of:=ROUND(SIN([.B12])-3*POWER([.B12]; 1/3);1) -> 6.8 | D12: of:=ROUND(-1*POWER([.B12]; 2)*COS(3*SQRT(ABS([.B12])));1) -> 42.5 | E12: of:=ROUND(SQRT(POWER([.C12]; 2)+10);1) -> 7.5 | F12: of:=ROUND(MIN([.$B$2:.B12]);1) -> -12.8 | G12: of:=ROUND(IF([.B12]>AVERAGE([.B12:.B36]);2*[.B12]-3;-1*3*[.B12]+2);1) -> -28.6
A13: 12 | B13: of:=[.B12]+(-1) -> -13.8 | C13: of:=ROUND(SIN([.B13])-3*POWER([.B13]; 1/3);1) -> 6.3 | D13: of:=ROUND(-1*POWER([.B13]; 2)*COS(3*SQRT(ABS([.B13])));1) -> -28.3 | E13: of:=ROUND(SQRT(POWER([.C13]; 2)+10);1) -> 7 | F13: of:=ROUND(MIN([.$B$2:.B13]);1) -> -13.8 | G13: of:=ROUND(IF([.B13]>AVERAGE([.B13:.B37]);2*[.B13]-3;-1*3*[.B13]+2);1) -> -30.6
A14: 13 | B14: of:=[.B13]+(-1) -> -14.8 | C14: of:=ROUND(SIN([.B14])-3*POWER([.B14]; 1/3);1) -> 6.6 | D14: of:=ROUND(-1*POWER([.B14]; 2)*COS(3*SQRT(ABS([.B14])));1) -> -113.7 | E14: of:=ROUND(SQRT(POWER([.C14]; 2)+10);1) -> 7.3 | F14: of:=ROUND(MIN([.$B$2:.B14]);1) -> -14.8 | G14: of:=ROUND(IF([.B14]>AVERAGE([.B14:.B38]);2*[.B14]-3;-1*3*[.B14]+2);1) -> -32.6
A15: 14 | B15: of:=[.B14]+(-1) -> -15.8 | C15: of:=ROUND(SIN([.B15])-3*POWER([.B15]; 1/3);1) -> 7.6 | D15: of:=ROUND(-1*POWER([.B15]; 2)*COS(3*SQRT(ABS([.B15])));1) -> -200 | E15: of:=ROUND(SQRT(POWER([.C15]; 2)+10);1) -> 8.2 | F15: of:=ROUND(MIN([.$B$2:.B15]);1) -> -15.8 | G15: of:=ROUND(IF([.B15]>AVERAGE([.B15:.B39]);2*[.B15]-3;-1*3*[.B15]+2);1) -> -34.6
A16: 15 | B16: of:=[.B15]+(-1) -> -16.8 | C16: of:=ROUND(SIN([.B16])-3*POWER([.B16]; 1/3);1) -> 8.6 | D16: of:=ROUND(-1*POWER([.B16]; 2)*COS(3*SQRT(ABS([.B16])));1) -> -272 | E16: of:=ROUND(SQRT(POWER([.C16]; 2)+10);1) -> 9.2 | F16: of:=ROUND(MIN([.$B$2:.B16]);1) -> -16.8 | G16: of:=ROUND(IF([.B16]>AVERAGE([.B16:.B40]);2*[.B16]-3;-1*3*[.B16]+2);1) -> -36.6
A17: 16 | B17: of:=[.B16]+(-1) -> -17.8 | C17: of:=ROUND(SIN([.B17])-3*POWER([.B17]; 1/3);1) -> 8.7 | D17: of:=ROUND(-1*POWER([.B17]; 2)*COS(3*SQRT(ABS([.B17])));1) -> -315.5 | E17: of:=ROUND(SQRT(POWER([.C17]; 2)+10);1) -> 9.3 | F17: of:=ROUND(MIN([.$B$2:.B17]);1) -> -17.8 | G17: of:=ROUND(IF([.B17]>AVERAGE([.B17:.B41]);2*[.B17]-3;-1*3*[.B17]+2);1) -> -38.6
A18: 17 | B18: of:=[.B17]+(-1) -> -18.8 | C18: of:=ROUND(SIN([.B18])-3*POWER([.B18]; 1/3);1) -> 8 | D18: of:=ROUND(-1*POWER([.B18]; 2)*COS(3*SQRT(ABS([.B18])));1) -> -319.6 | E18: of:=ROUND(SQRT(POWER([.C18]; 2)+10);1) -> 8.6 | F18: of:=ROUND(MIN([.$B$2:.B18]);1) -> -18.8 | G18: of:=ROUND(IF([.B18]>AVERAGE([.B18:.B42]);2*[.B18]-3;-1*3*[.B18]+2);1) -> -40.6
A19: 18 | B19: of:=[.B18]+(-1) -> -19.8 | C19: of:=ROUND(SIN([.B19])-3*POWER([.B19]; 1/3);1) -> 7.3 | D19: of:=ROUND(-1*POWER([.B19]; 2)*COS(3*SQRT(ABS([.B19])));1) -> -277.9 | E19: of:=ROUND(SQRT(POWER([.C19]; 2)+10);1) -> 8 | F19: of:=ROUND(MIN([.$B$2:.B19]);1) -> -19.8 | G19: of:=ROUND(IF([.B19]>AVERAGE([.B19:.B43]);2*[.B19]-3;-1*3*[.B19]+2);1) -> -42.6
A20: 19 | B20: of:=[.B19]+(-1) -> -20.8 | C20: of:=ROUND(SIN([.B20])-3*POWER([.B20]; 1/3);1) -> 7.3 | D20: of:=ROUND(-1*POWER([.B20]; 2)*COS(3*SQRT(ABS([.B20])));1) -> -190.2 | E20: of:=ROUND(SQRT(POWER([.C20]; 2)+10);1) -> 8 | F20: of:=ROUND(MIN([.$B$2:.B20]);1) -> -20.8 | G20: of:=ROUND(IF([.B20]>AVERAGE([.B20:.B44]);2*[.B20]-3;-1*3*[.B20]+2);1) -> -44.6
A21: 20 | B21: of:=[.B20]+(-1) -> -21.8 | C21: of:=ROUND(SIN([.B21])-3*POWER([.B21]; 1/3);1) -> 8.2 | D21: of:=ROUND(-1*POWER([.B21]; 2)*COS(3*SQRT(ABS([.B21])));1) -> -61.6 | E21: of:=ROUND(SQRT(POWER([.C21]; 2)+10);1) -> 8.8 | F21: of:=ROUND(MIN([.$B$2:.B21]);1) -> -21.8 | G21: of:=ROUND(IF([.B21]>AVERAGE([.B21:.B45]);2*[.B21]-3;-1*3*[.B21]+2);1) -> -46.6
A22: 21 | B22: of:=[.B21]+(-1) -> -22.8 | C22: of:=ROUND(SIN([.B22])-3*POWER([.B22]; 1/3);1) -> 9.2 | D22: of:=ROUND(-1*POWER([.B22]; 2)*COS(3*SQRT(ABS([.B22])));1) -> 97 | E22: of:=ROUND(SQRT(POWER([.C22]; 2)+10);1) -> 9.7 | F22: of:=ROUND(MIN([.$B$2:.B22]);1) -> -22.8 | G22: of:=ROUND(IF([.B22]>AVERAGE([.B22:.B46]);2*[.B22]-3;-1*3*[.B22]+2);1) -> -48.6
A23: 22 | B23: of:=[.B22]+(-1) -> -23.8 | C23: of:=ROUND(SIN([.B23])-3*POWER([.B23]; 1/3);1) -> 9.6 | D23: of:=ROUND(-1*POWER([.B23]; 2)*COS(3*SQRT(ABS([.B23])));1) -> 270.8 | E23: of:=ROUND(SQRT(POWER([.C23]; 2)+10);1) -> 10.1 | F23: of:=ROUND(MIN([.$B$2:.B23]);1) -> -23.8 | G23: of:=ROUND(IF([.B23]>AVERAGE([.B23:.B47]);2*[.B23]-3;-1*3*[.B23]+2);1) -> -50.6
A24: 23 | B24: of:=[.B23]+(-1) -> -24.8 | C24: of:=ROUND(SIN([.B24])-3*POWER([.B24]; 1/3);1) -> 9.1 | D24: of:=ROUND(-1*POWER([.B24]; 2)*COS(3*SQRT(ABS([.B24])));1) -> 442.4 | E24: of:=ROUND(SQRT(POWER([.C24]; 2)+10);1) -> 9.6 | F24: of:=ROUND(MIN([.$B$2:.B24]);1) -> -24.8 | G24: of:=ROUND(IF([.B24]>AVERAGE([.B24:.B48]);2*[.B24]-3;-1*3*[.B24]+2);1) -> -52.6
A25: 24 | B25: of:=[.B24]+(-1) -> -25.8 | C25: of:=ROUND(SIN([.B25])-3*POWER([.B25]; 1/3);1) -> 8.2 | D25: of:=ROUND(-1*POWER([.B25]; 2)*COS(3*SQRT(ABS([.B25])));1) -> 593.5 | E25: of:=ROUND(SQRT(POWER([.C25]; 2)+10);1) -> 8.8 | F25: of:=ROUND(MIN([.$B$2:.B25]);1) -> -25.8 | G25: of:=ROUND(IF([.B25]>AVERAGE([.B25:.B49]);2*[.B25]-3;-1*3*[.B25]+2);1) -> -54.6
A26: 25 | B26: of:=[.B25]+(-1) -> -26.8 | C26: of:=ROUND(SIN([.B26])-3*POWER([.B26]; 1/3);1) -> 8 | D26: of:=ROUND(-1*POWER([.B26]; 2)*COS(3*SQRT(ABS([.B26])));1) -> 707 | E26: of:=ROUND(SQRT(POWER([.C26]; 2)+10);1) -> 8.6 | F26: of:=ROUND(MIN([.$B$2:.B26]);1) -> -26.8 | G26: of:=ROUND(IF([.B26]>AVERAGE([.B26:.B50]);2*[.B26]-3;-1*3*[.B26]+2);1) -> 82.4